{"$id":"https://agent-development-skills.local/apple/apple-agent-packet-v2.schema.json","$schema":"https://json-schema.org/draft/2020-12/schema","additionalProperties":false,"properties":{"acceptance":{"additionalProperties":false,"properties":{"required_accessibility":{"items":{"type":"string"},"minItems":1,"type":"array","uniqueItems":true},"required_appearances":{"items":{"type":"string"},"minItems":1,"type":"array","uniqueItems":true},"required_input_modes":{"items":{"type":"string"},"minItems":1,"type":"array","uniqueItems":true}},"required":["required_appearances","required_accessibility","required_input_modes"],"type":"object"},"apple_registry_fingerprint":{"pattern":"^apple-registry-v1:[0-9a-f]{64}$","type":"string"},"bindings":{"items":{"additionalProperties":false,"properties":{"availability":{"minLength":1,"type":"string"},"binding_id":{"minLength":1,"type":"string"},"component_id":{"minLength":1,"type":"string"},"declaration_hash":{"pattern":"^sha256:[0-9a-f]{64}$","type":"string"},"framework":{"enum":["UIKit","SwiftUI"]},"module":{"minLength":1,"type":"string"},"source":{"minLength":1,"type":"string"},"symbol":{"minLength":1,"type":"string"}},"required":["availability","binding_id","component_id","declaration_hash","framework","module","source","symbol"],"type":"object"},"minItems":1,"type":"array"},"current_source_fingerprints":{"items":{"pattern":"^design-v1:[0-9a-f]{64}$","type":"string"},"minItems":2,"type":"array","uniqueItems":true},"environment":{"additionalProperties":false,"properties":{"device":{"minLength":1,"type":"string"},"minimum_os":{"minLength":1,"type":"string"},"platform":{"enum":["iOS","iPadOS","macOS","tvOS","watchOS","visionOS"]},"ui_framework":{"enum":["UIKit","SwiftUI"]}},"required":["platform","ui_framework","minimum_os","device"],"type":"object"},"fingerprint":{"pattern":"^apple-design-v2:[0-9a-f]{64}$","type":"string"},"packet_id":{"minLength":1,"type":"string"},"packet_version":{"const":"2.0.0"},"shared_packet":{"type":"object"},"shared_packet_fingerprint":{"pattern":"^design-v1:[0-9a-f]{64}$","type":"string"},"task_scope":{"additionalProperties":false,"properties":{"id":{"minLength":1,"type":"string"},"kind":{"enum":["screen","region","component"]}},"required":["kind","id"],"type":"object"}},"required":["packet_version","packet_id","shared_packet_fingerprint","current_source_fingerprints","apple_registry_fingerprint","task_scope","shared_packet","environment","bindings","acceptance","fingerprint"],"title":"Apple Agent Packet v2","type":"object"}
