{"acceptance":{"required_accessibility":["dynamic-type","reduce-motion","voice-over"],"required_appearances":["dark","light"],"required_input_modes":["focus","keyboard","touch"]},"apple_registry_fingerprint":"apple-registry-v1:e0ede22c453044c1a793723cca119d110370fe4c36eff790f037c2bd66178df4","bindings":[{"availability":"iOS 17.0+","binding_id":"binding.save-button.swiftui","component_id":"save-button","declaration_hash":"sha256:1111111111111111111111111111111111111111111111111111111111111111","framework":"SwiftUI","module":"SettingsUI","source":"Sources/SettingsUI/SaveButton.swift","symbol":"SaveButton"}],"current_source_fingerprints":["design-v1:99655a49b4d2690240780ac983d58648e38aad20648a733dff6dd18a07c7bca5","design-v1:b7fe65f0103bfaa6300375a48262b36584f42f4ebe5dedccd7af0bd6c6f66fab"],"environment":{"device":"iPhone","minimum_os":"17.0","platform":"iOS","ui_framework":"SwiftUI"},"fingerprint":"apple-design-v2:7b050f47cd5b5e2765ddc304573b0e3b5cf8c4c2f09418959da034f453e82488","packet_id":"apple-packet-9da034f453e82488","packet_version":"2.0.0","shared_packet":{"fingerprint":"design-v1:eb16dcb89eb14d7bb753854526bf7ba16add27896e0db6d8a0b4dab5a38dd65f","ir_slice":{"id":"save-button","regions":[{"components":[{"id":"save-button","provenance":{"confidence":1.0,"evidence_ref":"evidence-80a00c9e42a17c9a","kind":"source"},"slots":{"label":"Save"},"states":["default","disabled","pressed"],"token_refs":["color.action.primary"],"type":"button","variant":"primary"}],"id":"task-slice","layout":{"kind":"slice"}}],"states":[]},"packet_id":"packet-a0b4dab5a38dd65f","registry_slice":{"components":{"button":{"motion":{},"slots":["label"],"states":["default","disabled","pressed"],"token_refs":["color.action.primary"],"variants":["primary"]}},"registry_id":"shared-default","tokens":{"color.action.primary":{"semantic":"action-primary"}},"version":"1.0.0"},"schema_version":"1.0","source_fingerprints":["design-v1:99655a49b4d2690240780ac983d58648e38aad20648a733dff6dd18a07c7bca5","design-v1:b7fe65f0103bfaa6300375a48262b36584f42f4ebe5dedccd7af0bd6c6f66fab"],"stale_inputs":[],"task_scope":{"id":"save-button","kind":"component"},"unknowns":[]},"shared_packet_fingerprint":"design-v1:eb16dcb89eb14d7bb753854526bf7ba16add27896e0db6d8a0b4dab5a38dd65f","task_scope":{"id":"save-button","kind":"component"}}
